{
  "PK": "CNT#22222222-2222-4222-8222-222222222222#33333333-3333-4333-8333-333333333333",
  "SK": "S3",
  "entityType": "FirmCounterShard",
  "firmId": "22222222-2222-4222-8222-222222222222",
  "templateId": "33333333-3333-4333-8333-333333333333",
  "pending": 120,
  "declined": 4,
  "unclassified": 15,
  "version": 37,
  "createdBy": "00000000-0000-4000-8000-000000000001",
  "createdAt": "2026-10-22T10:00:00Z",
  "updatedBy": "00000000-0000-4000-8000-000000000001",
  "updatedAt": "2026-10-22T10:00:05Z",
  "state": "ACTIVE"
}
